{
  "$id": "https://thegraph.com/schemas/v1/registry.schema.json",
  "$schema": "http://json-schema.org/draft-07/schema",
  "description": "The Graph networks registry",
  "type": "object",
  "properties": {
    "$schema": {
      "type": "string",
      "minLength": 10,
      "format": "uri",
      "description": "Reference to this schema file"
    },
    "description": {
      "type": "string",
      "minLength": 10,
      "description": "Description of the registry"
    },
    "version": {
      "type": "string",
      "pattern": "^\\d+\\.\\d+\\.\\d+$",
      "description": "Version of the registry"
    },
    "updatedAt": {
      "type": "string",
      "format": "date-time",
      "description": "Date and time of the last update"
    },
    "networks": {
      "type": "array",
      "items": {
        "$ref": "./network.schema.json"
      },
      "description": "List of networks"
    }
  },
  "required": ["networks", "description", "updatedAt", "version", "$schema"],
  "additionalProperties": false
}
